{
  "overall_stance": "中性",
  "conviction_level": 0.58,
  "causal_chain": [
    {
      "level": "L4产业-手机",
      "cause": "存储超级周期抬升手机BOM，出货承压、毛利率下滑",
      "effect": "现金牛分部盈利中枢下移，集团近季利润显著恶化",
      "axiom_reference": "A1/A2/T3",
      "evidence": [
        "2026Q1收入991亿同比-10.9%，经调整净利61亿同比-43.1%",
        "手机出货3380万同比约-19%，分部毛利率约10.1%",
        "存储涨价为外生成本冲击，持续性取决于存储价格斜率"
      ],
      "confidence": 0.78,
      "time_lag": "已兑现1-2个季度，或延续至2026下半年"
    },
    {
      "level": "L4产业-汽车",
      "cause": "SU7/YU7矩阵放量，月交付连续站上3万+，但全年55万目标缺口大",
      "effect": "第二曲线有实增量但未达趋势击穿盈利边界；仍处投入期亏损",
      "axiom_reference": "A2/A3/T2/T6",
      "evidence": [
        "Q1交付80856辆；H1约18万；7月连续第4个月>3万",
        "全年55万目标要求H2月均约6万，约为当前节奏近2倍",
        "汽车及AI创新分部Q1经营亏损约31亿，毛利率约20.1%同比下滑"
      ],
      "confidence": 0.7,
      "time_lag": "验证窗口：2026Q3-Q4交付与新品（增程等）"
    },
    {
      "level": "L3情绪/估值",
      "cause": "人车家叙事在高位充分定价后回撤约46%，回购对冲但无法单独扭转基本面",
      "effect": "虚预期大幅回吐，当前位置更接近「修正后的期权定价」而非泡沫顶",
      "axiom_reference": "A4/T4/T5",
      "evidence": [
        "现价约27.4港元，52周区间21.3-59.9港元",
        "低于200日均线（约34.7），略高于50日均线（约26.5）",
        "分析师目标价中枢约39-40港元；公司推进最高200亿港元回购计划"
      ],
      "confidence": 0.72,
      "time_lag": "价格修正已发生；共识重定价看8/18季报"
    },
    {
      "level": "L2量价/择时",
      "cause": "产业双线背离（手机负反馈 vs 汽车正反馈）导致熵增，股价高波动震荡",
      "effect": "不具备「趋势加仓」条件；介入应绑定验证事件与边界回踩",
      "axiom_reference": "A5/T1/T9",
      "evidence": [
        "日线波动放大（如单日约-5%）",
        "下一关键催化剂：2026年8月18日前后Q2业绩"
      ],
      "confidence": 0.66,
      "time_lag": "日-周级择时；季报级定方向"
    }
  ],
  "stasis_conclusion": {
    "summary": "存量结构是「手机×AIoT现金牛 + 汽车成长期期权」。下边界（约21-24港元带/成本与回购支撑）相对清晰；上边界（前高50-60）需手机利润修复+汽车规模盈利共振才能再挑战。当前不在安全下边界极限，也远离泡沫上沿。",
    "axiom_refs": ["A1", "A3", "T4"],
    "confidence": 0.7,
    "evidence": [
      "生态与用户底座（MAU约7.46亿，IoT连接超11亿）构成中长期支撑结构",
      "失效条件：手机份额失速+汽车月销跌破2.5万且亏损扩大、回购无法托底"
    ],
    "pattern_matched": "oscillation"
  },
  "flow_conclusion": {
    "summary": "主导增量分裂：成本冲击导致盈利负增量，汽车交付正增量但不足以对冲利润。整体熵增，趋势定理未满足「持续同向累积」。",
    "axiom_refs": ["A2", "T2", "T9"],
    "confidence": 0.68,
    "evidence": [
      "资金/情绪：回撤后偶发反弹，非持续单边流入",
      "供需：手机端承压；汽车端需求尚可但产能/产品矩阵能否翻倍存疑",
      "业绩：绝对利润下行；ASP提升无法完全对冲成本",
      "政策：购税补贴退坡对车ASP有扰动",
      "情绪：人车家叙事降温中"
    ],
    "pattern_matched": "entropy_increase"
  },
  "consensus_conclusion": {
    "summary": "高位时虚>>实（汽车梦想透支）；回撤后虚实更接近匹配，但仍隐含「55万辆+利润修复」乐观假设。若市场抢跑季报，易再现虚大于实。",
    "axiom_refs": ["A4", "T5", "T6"],
    "confidence": 0.65,
    "evidence": [
      "主题生命周期：汽车主线从高潮进入验证期，非一日游，亦非已确认主升",
      "ERG：现价对短期利润偏苛刻，对长期生态期权仍有溢价"
    ],
    "pattern_matched": "virtual_real_resonance"
  },
  "feedback_conclusion": {
    "summary": "股价反馈处于「极致后的消化/再平衡」；手机业务负反馈主导盈利，汽车正反馈未强到切换集团趋势。拐点未到（产业增量未全面转负），但也未进入可重仓的强化正反馈。",
    "axiom_refs": ["A5", "T3", "T7"],
    "confidence": 0.63,
    "evidence": [
      "大周期：生态平台仍在；小周期：盈利下修与估值下修同步",
      "衰竭信号：手机利润斜率转负已出现；汽车交付斜率待加速验证"
    ],
    "pattern_matched": "oscillation"
  },
  "action_plan": {
    "primary_action": "不建议立刻重仓买入。定义为「条件式分批介入」：先观察仓/试仓，主仓位等到Q2验证或价格回踩下边界后再加。",
    "position_sizing": "总风险预算10%~20%。结构：试仓≤5%（可在25.5-27.5港元带）；主仓10%~15%留给确认后；禁止一次打满。",
    "entry_conditions": [
      "时机A（防守型主路径）：回踩23-25港元带（接近52周低点上方支撑/筹码密集）缩量止跌后再买第1-2批",
      "时机B（事件确认型）：8/18前后Q2显示手机毛利率环比止跌或指引存储成本见顶，且汽车月交付维持≥3万并给出H2加速路径",
      "时机C（突破确认型，概率较低）：放量站稳30港元上方并重新站上200日线方向，才考虑趋势加仓——需伴随盈利预期上修",
      "当前约27港元急跌日：最多试仓，不把「跌了就能买」当定理"
    ],
    "exit_conditions": [
      "跌破21.3港元前低且放量（边界失效）",
      "Q2/Q3连续显示手机毛利率继续恶化、经调整净利超预期下修",
      "汽车连续2个月交付显著低于3万或全年目标正式大幅下修",
      "试仓浮亏达建仓价-15%强制复盘"
    ],
    "timing_notes": "最优介入不是「现在市价梭哈」，而是「8/18前轻仓埋伏 + 季报后加码」或「更深回踩再启动」。急跌追买违反边界附近操作纪律。"
  },
  "risk_framework": {
    "key_risks": [
      "存储价格继续上涨吞噬手机利润",
      "汽车55万目标大幅落空导致叙事二次坍塌",
      "港股流动性与南向资金波动",
      "汽车竞争加剧导致ASP/毛利继续下行",
      "季报前抢跑后「买预期卖事实」"
    ],
    "stop_logic": "价格止损与产业证伪双触发：破前低或手机利润+汽车交付双杀则清仓级减持。",
    "max_drawdown_tolerance": "单标的回撤预算≤组合净值3%；该头寸自身-20%必须降仓。",
    "boundary_distance_warning": "相对前高已大幅回撤，但相对下边界（~21）并不极端便宜；禁止因「腰斩了」判定低风险（A3/T4）。"
  },
  "falsification_conditions": [
    {
      "condition": "Q2手机分部毛利率环比继续下滑且公司指引成本压力贯穿全年",
      "monitoring_method": "8/18季报分部毛利、库存与指引",
      "implication": "盈利负增量延续，估值中枢继续下移",
      "alternative_action": "取消主仓计划，仅保留极小观察仓或清仓",
      "probability": 0.35
    },
    {
      "condition": "汽车月交付跌破2.5万或明确放弃接近55万目标",
      "monitoring_method": "月度交付公告、管理层口径",
      "implication": "汽车虚实共振破裂（T6）",
      "alternative_action": "按纯手机周期股重估，显著降低仓位上限",
      "probability": 0.3
    },
    {
      "condition": "存储ASP进入下行、手机出货与毛利同步修复",
      "monitoring_method": "存储报价、Q3手机毛利、出货数据",
      "implication": "负增量反转，可上调至「看多」并提前主仓",
      "alternative_action": "在28-32港元带提高仓位至计划上限",
      "probability": 0.32
    }
  ],
  "monitoring_checklist": [
    {
      "variable": "手机分部毛利率",
      "threshold": "环比止跌为加仓必要条件",
      "axiom_link": "A2/T3",
      "frequency": "季报"
    },
    {
      "variable": "汽车月交付",
      "threshold": "连续≥3万；向4-5万加速为趋势增强",
      "axiom_link": "A2/T2",
      "frequency": "月"
    },
    {
      "variable": "存储芯片价格斜率",
      "threshold": "环比转负/走平=手机成本拐点",
      "axiom_link": "A2",
      "frequency": "周/月"
    },
    {
      "variable": "股价相对21.3/25/30三关",
      "threshold": "破21.3减仓；站稳30再评估趋势仓",
      "axiom_link": "A3/T1",
      "frequency": "日"
    },
    {
      "variable": "回购执行节奏",
      "threshold": "仅作辅助，不可单独作为买入理由",
      "axiom_link": "A4",
      "frequency": "周"
    }
  ],
  "emergent_insights": [
    "小米当前是「双序参量系统」：存储价格斜率决定手机利润底，汽车交付加速度决定叙事高度；两者同向改善才会触发趋势定理。",
    "55万辆目标本身可能是虚预期锚点——市场真正定价的是「可否稳定在年化36-45万并收缩亏损」，而非口号目标。"
  ],
  "immune_verdict": "PASS"
}
